<?xml version="1.0" encoding="UTF-8"?>

<!ELEMENT coches  ( marca+ )>


<!ELEMENT marca  ( modelo+ )>

<!ATTLIST marca
 nombre CDATA #REQUIRED
>

<!ELEMENT modelo  (nombre ,velocidad* ,cilindrada* ,potencia* ,consumo? ,co2? ,combustible?)>

<!ATTLIST modelo
 nombre CDATA #REQUIRED
>

<!ELEMENT nombre  ( #PCDATA )>

<!ELEMENT velocidad  ( #PCDATA )>

<!ELEMENT cilindrada  ( #PCDATA )>

<!ELEMENT potencia  ( #PCDATA )>

<!ELEMENT consumo  ( #PCDATA )>

<!ELEMENT co2  ( #PCDATA )>

<!ELEMENT combustible  ( #PCDATA )>
